{
  "event": "ConsentWithdrawn",
  "contract": "proof-registry",
  "contract_version": "0.1.0",
  "schema_version": 1,
  "topics": [
    "consent_withdrawn"
  ],
  "payload": {
    "proof_id_hash": {
      "type": "BytesN<32>",
      "description": "Hash of the proof whose disclosure consent was withdrawn.",
      "example": "1111111111111111111111111111111111111111111111111111111111111111"
    },
    "policy_hash": {
      "type": "BytesN<32>",
      "description": "Hash of the disclosure policy the withdrawn consent applied to.",
      "example": "2222222222222222222222222222222222222222222222222222222222222222"
    },
    "sequence": {
      "type": "U64",
      "description": "One-based withdrawal sequence; the n-th withdrawal ever committed.",
      "example": 1
    },
    "reason_code": {
      "type": "U32",
      "description": "Published reason code 1 to 4. Never reason text.",
      "example": 1
    },
    "commitment_hash": {
      "type": "BytesN<32>",
      "description": "Network- and registry-scoped consent withdrawal commitment.",
      "example": "3333333333333333333333333333333333333333333333333333333333333333"
    }
  },
  "emitted_by": "withdraw_disclosure_consent",
  "description": "Emitted when an issuer commits a hash-only record that disclosure consent for a proof and policy was withdrawn.",
  "compatibility": "additive"
}
