{
  "event": "AdminChanged",
  "contract": "protocol-config",
  "contract_version": "0.1.0",
  "schema_version": 1,
  "topics": ["AdminChanged"],
  "payload": {
    "proposal_id": {
      "type": "BytesN<32>",
      "description": "Governance proposal identifier.",
      "example": "0000000000000000000000000000000000000000000000000000000000000000"
    },
    "new_admin": {
      "type": "Address",
      "description": "Stellar address of the new protocol administrator.",
      "example": "GCFIRY65OQE7DFP5KLNS2PF2LVZMUZYJX4OZIEQ36N2IQANUB5XVYOJR"
    }
  },
  "emitted_by": "set_admin",
  "description": "Emitted when the protocol administrator is transferred to a new address.",
  "compatibility": "stable"
}
